{
  "schemaVersion": "1.1.0",
  "resourceGraph": {
    "request": {
      "method": "POST",
      "operation": "subscription-defender-cleanup-inventory",
      "scopeResourceId": "/subscriptions/00000000-0000-0000-0000-000000000000",
      "resourcePath": "providers/Microsoft.ResourceGraph/resources",
      "apiVersion": "2022-10-01",
      "queriedAt": "2025-01-01T08:56:00Z",
      "body": {
        "subscriptions": [
          "00000000-0000-0000-0000-000000000000"
        ],
        "query": "union Resources, InsightResources, SecurityResources, PolicyResources | where type in~ ('microsoft.compute/virtualmachines/extensions', 'microsoft.hybridcompute/machines/extensions', 'microsoft.insights/datacollectionruleassociations', 'microsoft.security/pricings', 'microsoft.authorization/policyassignments') | project id, name, type, properties, identity, location | order by id asc",
        "options": {
          "resultFormat": "objectArray"
        }
      }
    },
    "response": {
      "totalRecords": 9,
      "count": 9,
      "resultTruncated": "false",
      "facets": [],
      "data": [
        {
          "id": "/subscriptions/00000000-0000-0000-0000-000000000000/providers/Microsoft.Authorization/policyAssignments/defender-baseline",
          "name": "defender-baseline",
          "type": "microsoft.authorization/policyassignments",
          "properties": {
            "displayName": "Existing Defender baseline",
            "enforcementMode": "Default",
            "policyDefinitionId": "/subscriptions/00000000-0000-0000-0000-000000000000/providers/Microsoft.Authorization/policyDefinitions/00000000-0000-0000-0000-000000000020",
            "parameters": {}
          },
          "identity": {
            "type": "SystemAssigned",
            "principalId": "00000000-0000-0000-0000-000000000021",
            "tenantId": "00000000-0000-0000-0000-000000000022"
          },
          "location": "westeurope"
        },
        {
          "id": "/subscriptions/00000000-0000-0000-0000-000000000000/providers/Microsoft.Security/pricings/CloudPosture",
          "name": "CloudPosture",
          "type": "microsoft.security/pricings",
          "properties": {
            "pricingTier": "Free",
            "enforce": "False",
            "extensions": []
          },
          "identity": null,
          "location": null
        },
        {
          "id": "/subscriptions/00000000-0000-0000-0000-000000000000/providers/Microsoft.Security/pricings/Containers",
          "name": "Containers",
          "type": "microsoft.security/pricings",
          "properties": {
            "pricingTier": "Free",
            "enforce": "False",
            "extensions": []
          },
          "identity": null,
          "location": null
        },
        {
          "id": "/subscriptions/00000000-0000-0000-0000-000000000000/providers/Microsoft.Security/pricings/OpenSourceRelationalDatabases",
          "name": "OpenSourceRelationalDatabases",
          "type": "microsoft.security/pricings",
          "properties": {
            "pricingTier": "Free",
            "enforce": "False",
            "extensions": []
          },
          "identity": null,
          "location": null
        },
        {
          "id": "/subscriptions/00000000-0000-0000-0000-000000000000/providers/Microsoft.Security/pricings/SqlServers",
          "name": "SqlServers",
          "type": "microsoft.security/pricings",
          "properties": {
            "pricingTier": "Free",
            "enforce": "False",
            "extensions": []
          },
          "identity": null,
          "location": null
        },
        {
          "id": "/subscriptions/00000000-0000-0000-0000-000000000000/providers/Microsoft.Security/pricings/VirtualMachines",
          "name": "VirtualMachines",
          "type": "microsoft.security/pricings",
          "properties": {
            "pricingTier": "Free",
            "enforce": "False",
            "extensions": []
          },
          "identity": null,
          "location": null
        },
        {
          "id": "/subscriptions/00000000-0000-0000-0000-000000000000/resourceGroups/rg-mh-source-example/providers/Microsoft.Compute/virtualMachines/vm-dotnet-user001/extensions/AzureMonitorWindowsAgent",
          "name": "AzureMonitorWindowsAgent",
          "type": "microsoft.compute/virtualmachines/extensions",
          "properties": {
            "publisher": "Microsoft.Azure.Monitor",
            "type": "AzureMonitorWindowsAgent",
            "typeHandlerVersion": "1.0",
            "autoUpgradeMinorVersion": true,
            "enableAutomaticUpgrade": true,
            "provisioningState": "Succeeded"
          },
          "identity": null,
          "location": "westeurope"
        },
        {
          "id": "/subscriptions/00000000-0000-0000-0000-000000000000/resourceGroups/rg-shared-example/providers/Microsoft.HybridCompute/machines/arc-existing/extensions/AzureMonitorLinuxAgent",
          "name": "AzureMonitorLinuxAgent",
          "type": "microsoft.hybridcompute/machines/extensions",
          "properties": {
            "publisher": "Microsoft.Azure.Monitor",
            "type": "AzureMonitorLinuxAgent",
            "typeHandlerVersion": "1.0",
            "autoUpgradeMinorVersion": true,
            "enableAutomaticUpgrade": true,
            "provisioningState": "Succeeded"
          },
          "identity": null,
          "location": "westeurope"
        },
        {
          "id": "/subscriptions/00000000-0000-0000-0000-000000000000/resourceGroups/rg-mh-source-example/providers/Microsoft.Compute/virtualMachines/vm-dotnet-user001/providers/Microsoft.Insights/dataCollectionRuleAssociations/defender-default",
          "name": "defender-default",
          "type": "microsoft.insights/datacollectionruleassociations",
          "properties": {
            "dataCollectionRuleId": "/subscriptions/00000000-0000-0000-0000-000000000000/resourceGroups/rg-mh-source-example/providers/Microsoft.Insights/dataCollectionRules/dcr-defender-default"
          },
          "identity": null,
          "location": null
        }
      ]
    }
  },
  "autoProvisioningSettings": {
    "request": {
      "method": "GET",
      "operation": "subscription-defender-auto-provisioning-settings",
      "scopeResourceId": "/subscriptions/00000000-0000-0000-0000-000000000000",
      "resourcePath": "providers/Microsoft.Security/autoProvisioningSettings",
      "apiVersion": "2017-08-01-preview",
      "queriedAt": "2025-01-01T08:57:00Z"
    },
    "response": {
      "value": [
        {
          "id": "/subscriptions/00000000-0000-0000-0000-000000000000/providers/Microsoft.Security/autoProvisioningSettings/default",
          "name": "default",
          "type": "Microsoft.Security/autoProvisioningSettings",
          "properties": {
            "autoProvision": "Off"
          }
        }
      ]
    }
  },
  "settings": {
    "request": {
      "method": "GET",
      "operation": "subscription-defender-settings",
      "scopeResourceId": "/subscriptions/00000000-0000-0000-0000-000000000000",
      "resourcePath": "providers/Microsoft.Security/settings",
      "apiVersion": "2021-06-01",
      "queriedAt": "2025-01-01T08:58:00Z"
    },
    "response": {
      "value": [
        {
          "id": "/subscriptions/00000000-0000-0000-0000-000000000000/providers/Microsoft.Security/settings/Sentinel",
          "name": "Sentinel",
          "type": "Microsoft.Security/settings",
          "kind": "AlertSyncSettings",
          "properties": {
            "enabled": false
          }
        },
        {
          "id": "/subscriptions/00000000-0000-0000-0000-000000000000/providers/Microsoft.Security/settings/WDATP",
          "name": "WDATP",
          "type": "Microsoft.Security/settings",
          "kind": "DataExportSettings",
          "properties": {
            "enabled": false
          }
        }
      ]
    }
  }
}
